{
  "caseId": "synthetic:sepsis-005",
  "source": "synthetic",
  "demographics": { "ageBand": "75-84", "sex": "male" },
  "presentation": {
    "chiefComplaint": "Fever, confusion, and weakness for two days",
    "history": {
      "hpi": "Two days of fevers, rigors, dysuria and worsening confusion. Family notes decreased oral intake and reduced urine output. Today he is lethargic and not himself.",
      "pmh": ["Benign prostatic hyperplasia", "Type 2 diabetes", "Chronic kidney disease"],
      "medications": ["Tamsulosin", "Metformin"],
      "allergies": ["Penicillin (rash)"],
      "socialHistory": "Lives alone, independent at baseline.",
      "redFlags": [
        "Sepsis criteria: fever + tachycardia + tachypnea + hypotension",
        "Altered mental status (acute confusion from baseline)",
        "Suspected source (urinary) with end-organ dysfunction",
        "Requires early antibiotics and fluids (sepsis bundle)"
      ],
      "redFlagConcepts": [
        {
          "flag": "Sepsis criteria: fever + tachycardia + tachypnea + hypotension",
          "anchors": ["fever", "fevers", "temperature", "temp", "hot", "chills", "rigors", "sweats", "infection"],
          "any": ["fever", "fevers", "temperature", "chills", "rigors", "hot", "sweats"]
        },
        {
          "flag": "Altered mental status (acute confusion from baseline)",
          "anchors": ["confused", "confusion", "disoriented", "drowsy", "lethargic", "alert", "oriented", "baseline", "behaving", "himself"],
          "any": ["confused", "confusion", "disoriented", "drowsy", "lethargic", "mental", "behaving", "baseline", "himself", "self"]
        },
        {
          "flag": "Suspected source (urinary) with end-organ dysfunction",
          "anchors": ["urine", "urinary", "urinate", "urinating", "pee", "dysuria", "burning", "frequency", "output", "source", "infection"],
          "any": ["urine", "urinary", "urinate", "urinating", "pee", "dysuria", "burning", "kidney", "output"]
        },
        {
          "flag": "Requires early antibiotics and fluids (sepsis bundle)",
          "anchors": ["antibiotics", "antibiotic", "fluids", "fluid", "bolus", "cultures", "culture", "lactate"]
        }
      ]
    },
    "groundTruthVitals": {
      "heartRate": 118,
      "systolicBP": 88,
      "diastolicBP": 54,
      "respiratoryRate": 26,
      "spo2": 93,
      "temperatureC": 39.2,
      "painScore": 3,
      "glucose": 196,
      "avpu": "V"
    }
  },
  "expert": {
    "esi": 2,
    "esiRationale": "Septic shock physiology (hypotension, tachycardia, tachypnea, altered mental status) in an elderly patient. High-risk, time-critical for the sepsis bundle but not yet requiring an immediate door-side life-saving procedure such as intubation, so ESI 2. Under-triage here delays antibiotics and fluids.",
    "requiresLifeSaving": false,
    "isHighRisk": true,
    "criticalInterventions": ["IV_ACCESS", "FLUID_BOLUS", "ANTIBIOTICS", "OXYGEN", "CARDIAC_MONITOR", "GLUCOSE_CHECK"],
    "resourcesPredicted": 6
  },
  "outcome": {
    "disposition": "ICU",
    "edLengthOfStayMinutes": 330,
    "diagnosisCategories": ["Sepsis", "Urinary tract infection", "Acute kidney injury"]
  },
  "provenance": {
    "license": "synthetic-generated",
    "deidentified": true,
    "sourceRef": "ED Triage Trainer hand-authored seed case"
  }
}
