{
  "caseId": "synthetic:stroke-004",
  "source": "synthetic",
  "demographics": { "ageBand": "75-84", "sex": "female" },
  "presentation": {
    "chiefComplaint": "Sudden left-sided weakness and slurred speech 45 minutes ago",
    "history": {
      "hpi": "Family reports she suddenly developed left facial droop, left arm and leg weakness, and slurred speech while watching television 45 minutes ago. Last known well is well within the thrombolysis window.",
      "pmh": ["Atrial fibrillation", "Hypertension"],
      "medications": ["Apixaban", "Metoprolol"],
      "allergies": ["None known"],
      "socialHistory": "Lives with daughter, non-smoker.",
      "redFlags": [
        "Acute focal neurological deficit (FAST positive)",
        "Within thrombolysis/thrombectomy window — time-critical",
        "Requires immediate stroke pathway activation and neuro checks"
      ]
    },
    "groundTruthVitals": {
      "heartRate": 96,
      "systolicBP": 182,
      "diastolicBP": 98,
      "respiratoryRate": 18,
      "spo2": 96,
      "temperatureC": 36.9,
      "painScore": 0,
      "glucose": 142,
      "avpu": "A"
    }
  },
  "expert": {
    "esi": 2,
    "esiRationale": "Acute stroke within the treatment window is a time-critical, high-risk presentation requiring immediate stroke-pathway activation. Patient is protecting the airway and hemodynamically adequate, so ESI 2 rather than 1. Under-triaging this to ESI 3+ would delay thrombolysis/thrombectomy.",
    "requiresLifeSaving": false,
    "isHighRisk": true,
    "criticalInterventions": ["NEURO_CHECK", "GLUCOSE_CHECK", "IV_ACCESS", "CARDIAC_MONITOR"],
    "resourcesPredicted": 5
  },
  "outcome": {
    "disposition": "ADMIT",
    "edLengthOfStayMinutes": 260,
    "diagnosisCategories": ["Acute ischemic stroke"]
  },
  "provenance": {
    "license": "synthetic-generated",
    "deidentified": true,
    "sourceRef": "ED Triage Trainer hand-authored seed case"
  }
}
